{
  "$schema": "http://json-schema.org/draft-07/schema#",
  "title": "SIEM Sprint 1 security event candidate",
  "type": "object",
  "additionalProperties": false,
  "required": [
    "event_id",
    "timestamp",
    "source",
    "event_type",
    "severity",
    "title",
    "description",
    "details"
  ],
  "properties": {
    "event_id": {
      "type": "string",
      "minLength": 1,
      "description": "Unique within source; stable on retries. UUID is not required.",
      "pattern": "\\S"
    },
    "timestamp": {
      "type": "string",
      "format": "date-time",
      "pattern": "Z$",
      "description": "Original detection time in UTC."
    },
    "source": {
      "type": "string",
      "enum": [
        "ids",
        "honeypot",
        "scanner"
      ]
    },
    "event_type": {
      "type": "string",
      "minLength": 1,
      "description": "Event type reported by the producer.",
      "pattern": "\\S"
    },
    "severity": {
      "type": "string",
      "enum": [
        "low",
        "medium",
        "high",
        "critical"
      ]
    },
    "title": {
      "type": "string",
      "minLength": 1,
      "pattern": "\\S"
    },
    "description": {
      "type": "string",
      "minLength": 1,
      "pattern": "\\S"
    },
    "details": {
      "type": "object",
      "additionalProperties": true,
      "description": "Producer-specific event attributes."
    }
  }
}
